ID,章,章タイトル,節,節タイトル,問題番号,難易度,文法事項,Focus,日本語,英文（穴埋め）,ヒント,英文（完全）,答え,Tip（思考誘導）,解説,語句・熟語,注意・補足,Words to Use
3,7章,分詞,-,-,164-1,基本,-,F 103,一人暮らしの高齢者が増えている。,The number of (e )( )( )( ) is increasing.,e,The number of elderly people living alone is increasing.,elderly / people / living / alone,高齢者の「数」が増えているので、主語に the number of~を使う。「一人暮らしの高齢者」は「一人で暮らしている高齢者」と考え、分詞を含む2語を使って「高齢者」を修飾する。2語で名詞を修飾する場合、それらを置く位置は?,分詞句(分詞を含む2語以上の語のかたまり)の場合、名詞の後に分詞句を置いて修飾する(分詞の後置修飾)。現在分詞を使った分詞句 living alone が、名詞句 elderly people 「高齢者」を後ろから修飾している。,live alone 「一人暮らしする」,-,material / birth rate / elderly people / foreign / influence
4,7章,分詞,-,-,164-2,基本,-,F 103,外国語で書かれたメニューを提供しているレストランもある。,Some restaurants offer ( )(w )( )( )( ).,w,Some restaurants offer menus written in foreign languages.,menus / written / in / foreign / languages,「外国語で書かれた」はどう表現する? それを置く位置は?,この文では過去分詞を使った分詞句 written in foreign languagesが、名詞 menus を後ろから修飾している。,-,-,material / birth rate / elderly people / foreign / influence
5,7章,分詞,-,-,165,発展,-,-,キッチンから強いにおいがする。,(smell / is / coming / there / a strong) from the kitchen.,-,There is a strong smell coming from the kitchen.,There / is / a / strong / smell / coming,「キッチンから来る強いにおいがある」と考えて、there is 構文を使う。,There is S doing 「~しているSがある [いる]、Sが〜している」。S is doing という能動の関係 (a strong smell is coming) を含む there is 構文。,-,-,material / birth rate / elderly people / foreign / influence
6,7章,分詞,-,-,166,発展,-,-,いすにバッグが置き忘れてあり、女性がそれを手に取ろうとしている。,"There ( )( )( ) on the chair, and the woman is picking it up.",-,"There is a bag left on the chair, and the woman is picking it up.",is / a / bag / left,"「いすの上に置き忘れられたバッグがある」と考えて, there is 構文を使う。",There is S done 「~されるSがある [いる]、Sが〜される」。S is done という受動の関係 (a bag is left) を含む there is 構文。,-,-,material / birth rate / elderly people / foreign / influence
7,7章,分詞,-,-,167,基本,-,F 105,犬が飼い主のもとに走って来た。,The dog ( )( ) to his owner.,-,The dog came running to his owner.,came / running,「走って来た→走りながら来た」と表現する。,分詞には限定用法だけでなく、補語として使う叙述用法もある。SVCのCが現在分詞。SとCが能動の関係。,-,-,material / birth rate / elderly people / foreign / influence
8,7章,分詞,-,-,168,基本,-,-,子どもは親の影響を受けて育つ。,( )( )( )( ) by their parents.,-,Children grow up influenced by their parents.,Children / grow / up / influenced,「影響を受けて育つ→影響されて成長する」と表現する。「子どもは→子どもたちは」,SVCのCが過去分詞。SとCが受動の関係。,-,-,material / birth rate / elderly people / foreign / influence
9,7章,分詞,-,-,169,基本,-,F 105,お待たせしてしまって申し訳ありません。,I'm sorry to ( )( )( )( ).,-,I'm sorry to have kept you waiting.,have / kept / you / waiting,「待たせる」は「あなたを待っている状態にしておく」と考え、to不定詞の中をVOCで表す。「待たせておく」動作が継続しているので時制はどうする?,to不定詞の中での (S) VOCのCが現在分詞。O(you) と C (waiting)は能動の関係。受動の関係ではない (×keep you waited)。「これまでずっと待たせておいた」という意味で、完了不定詞 (to have kept...)にする。,keep A doing 「Aに〜させ続ける」,-,keep / inform / see / hear / call
10,7章,分詞,-,-,170,基本,-,F 105,何か進展があれば随時私に知らせておいてください。,Please (k )( )( ) of any developments.,k,Please keep me informed of any developments.,keep / me / informed,「私」が「知らされている」状態を「保つ」と表現する。受動の関係を含む、VOCの表現。,(S) VOCのCが過去分詞。○ (me)とC (informed) は受動の関係。Keep me informed. (随時私に知らせておいて。),be informed of A 「Aについて知らされている」,-,keep / inform / see / hear / call
11,7章,分詞,-,-,171,基本,-,F 106,昨夜のコンサートで先生が踊っているのを見た。,I ( )( ) teacher ( ) at the concert last night.,-,I saw my teacher dancing at the concert last night.,saw / my / dancing,「先生」が「踊っている」という能動の関係を含む〈知覚動詞+O+C〉の表現。,知覚動詞+○+現在分詞。○(my teacher) と C (dancing) は能動の関係。,-,-,keep / inform / see / hear / call
12,7章,分詞,-,-,172,基本,-,F 106,私は名前を呼ばれて辺りを見回した。,I ( ) my ( )(c ) and looked around.,c,I heard my name called and looked around.,heard / name / called,「名前を呼ばれる」は「名前が呼ばれるのが聞こえる」と表現する。受動の関係を含む〈知覚動詞+O+C〉の表現。,知覚動詞+○+過去分詞。O(my name) と C (called) は受動の関係。I heard my name called. (自分の名前が呼ばれるのが聞こえた。),look around 「見回す」,-,keep / inform / see / hear / call
13,7章,分詞,-,-,173,基本,-,-,昨夜のコンサートで先生は踊っているところを見られた。,My teacher ( )( )( ) at the concert last night.,-,My teacher was seen dancing at the concert last night.,was / seen / dancing,〈知覚動詞+○+現在分詞〉を受動態にすると?,A is seen doing 「Aは~しているところを見られる」 一動作の途中の一時点。see A doing 「Aが〜しているのが見える」の受動態。,-,A is seen to do 「Aは〜するのを見られる」 一動作の最初から最後まで。,keep / inform / see / hear / call
14,7章,分詞,-,-,174-1,基本,-,F 107,写真を撮られるのが好きではない人もいる。,Some people do not like ( ) their picture ( ).,-,Some people do not like having their picture taken.,having / taken,「写真を撮られる→自身の写真を撮ってもらう」。「･･･を〜してもらう」という使役を表す表現は?,have [get] +○+過去分詞は、以下の3つの意味を表す。①使役・依頼 「A(物)を〜してもらう」、②被害 「A(物)を~される」、③完了「A(物事)を(自分で)~してしまう」。Aは目的語(○)。Aと過去分詞は「Aが〜される」という関係(A is done)。,-,-,steal / finish / understand / hear / tear / run / cross
15,7章,分詞,-,-,174-2,基本,-,F 107,私はローマの地下鉄で財布を盗まれた。,I (h ) my wallet ( ) on the subway in Rome.,h,I had my wallet stolen on the subway in Rome.,had / stolen,「･･･を〜される」という被害を表す表現は?,〈have+O+過去分詞〉が被害を表す。,steal 「~を盗む」 一活用は steal-stole-stolen,-,steal / finish / understand / hear / tear / run / cross
16,7章,分詞,-,-,174-3,基本,-,-,明日までにこのレポートを仕上げる必要がある。,I need to (g ) this paper ( ) by tomorrow.,g,I need to get this paper finished [done] by tomorrow.,get / finished [done],「レポートを仕上げる→レポートを終えてしまう」という完了を表す表現。,〈get+O+過去分詞〉が完了を表す。,get A finished / get A done 「Aを終わらせる」,-,steal / finish / understand / hear / tear / run / cross
17,7章,分詞,-,-,175,発展,-,F 107,私は何とか英語で意思を伝えることができた。,I managed to ( )( )( ) in English.,-,I managed to make myself understood in English.,make / myself / understood,「意思を伝える→自分自身を(相手から) 理解されるようにする」と表現する。,make oneself understood 「自分の言うことを理解してもらう」,manage to do 「何とか〜する」,-,steal / finish / understand / hear / tear / run / cross
18,7章,分詞,-,-,176,発展,-,F 107,騒音の中、私は自分の声を届けるために大声を出さなければならなかった。,I had to shout to ( )( )( ) above the noise.,-,I had to shout to make myself heard above the noise.,make / myself / heard,「自分の声を届ける→自分自身を(相手に)聞かれるようにする」と表現する。,make oneself heard「自分の声を聞かせる」,above [over] the noise 「騒音より大きく、騒音に負けないくらいに」,-,steal / finish / understand / hear / tear / run / cross
19,7章,分詞,-,-,177,基本,-,F 112,ケンは涙を流しながらその映画を見た。,Ken watched the movie ( )(t )(r ) down his face.,t / r,Ken watched the movie with tears running down his face.,with / tears / running,「涙を流しながら→ 涙が流れている状態で」と表現する。「涙」が「流れる」 という能動の関係だから分詞の形は?,with A doing 「Aが〜している状態で」。Aと現在分詞は能動の関係 (A is doing)。「~している状態で」という付帯状況。,tears run down A 「Aを涙が流れ落ちる」 - tears は複数形,-,steal / finish / understand / hear / tear / run / cross
20,7章,分詞,-,-,178,基本,-,F 112,その女性は腕を組んで立っている。,The woman is standing ( ) her (a )( ).,a,The woman is standing with her arms crossed [folded].,with / arms / crossed [folded],「腕を組んで→ 腕が組まれた状態で」と表現する。「腕」が「組まれる」という受動の関係だから分詞の形は?,with A done 「Aが〜された状態で」。Aと過去分詞は受動の関係 (A is done)。「~された状態で」という付帯状況。,cross one's arms / fold one's arms 「腕を組む」,-,steal / finish / understand / hear / tear / run / cross
21,7章,分詞,-,-,179,基本,-,-,彼らは今週末の吹奏楽演奏会の練習で忙しい。,They (a )( )( ) for the brass band concert this weekend.,a,They are busy practicing for the brass band concert this weekend.,are / busy / practicing,「練習で忙しい→ 練習するのに忙しい」と表現する。,be busy (in) doing 「~するのに忙しい」,-,-,steal / finish / understand / hear / tear / run / cross
22,7章,分詞,-,-,180,基本,-,F 108,多くの子どもはスクリーンを見るのに時間を使い過ぎだ。,Many children ( )( )( )( )( )( ) screens.,-,Many children spend too much time looking at screens.,spend / too / much / time / looking / at,「スクリーンを見ながらあまりにも多くの時間を過ごす」と表現する。,spend A (in) doing 「~してA(時間)を過ごす、〜してA(金・労力)を費やす」,look at a screen 「(スマホなどの) スクリーン [画面]を見る」,-,spend / look at / difficulty / see
23,7章,分詞,-,-,181,基本,-,-,多くの家庭が子どもの教育費の支払いに苦労している。,Many families ( )(d )( )( ) their children's education.,d,Many families have difficulty paying for their children's education.,have / difficulty / paying / for,「支払いに苦労している→支払うのに困難を持っている」と表現する。,have difficulty [trouble] (in) doing 「~するのに苦労する」,children's education 「子どもの教育」,-,spend / look at / difficulty / see
24,7章,分詞,-,-,182,基本,-,F 108,その男性はカフェで新聞を読みながらコーヒーを飲んでいる。,"The man is drinking coffee, ( )( )( ) in a café.",-,"The man is drinking coffee(,) reading a newspaper in a café.",reading / a / newspaper,2つの事柄が同時に起こっているときに使う構文は? 「~しながら･･･」,分詞句が副詞の働きをするものを分詞構文と呼ぶ。分詞構文がどういう意味を表すかは文脈による。この文では「~しながら」という付帯状況を表している。分詞構文の前のコンマは付けても付けなくてもよい。,-,-,spend / look at / difficulty / see
25,7章,分詞,-,-,183,基本,-,F 108,アプリの使い方がわからず、友達に助けを求めた。,"( )( )( )( ) use the app, I asked my friends for help.",-,"Not knowing how to use the app, I asked my friends for help.",Not / knowing / how / to,「使い方がわからず→ 使い方を知らないので」と表現する。Because [Since] I don't know... と同じ意味を分詞構文で表すと? 否定形の分詞構文の形は?,"分詞構文を否定形にする場合は、分詞の直前に not または never を置く。Because I didn't know how to use the app, I asked my friends for help. → Not knowing how to use the app, I asked my friends for help. 否定形の分詞構文。",-,-,spend / look at / difficulty / see
26,7章,分詞,-,-,184,基本,-,F 110,本を読み終えて、図書館に返却した。,"( )( ) reading the book, I returned it to the library.",-,"Having finished reading the book, I returned it to the library.",Having / finished,「読み終えた」のは「返した」 よりも前のこと。After I (had) finished ... と同じ意味を分詞構文で表すと? 完了形の分詞構文。,分詞構文の内容が、主節の動詞が表す時よりも「前」の時である場合は、完了形の分詞構文 having+過去分詞にする。「~して」「~したので」。,-,-,spend / look at / difficulty / see
27,7章,分詞,-,-,185,基本,-,F 108,山の上から見ると、街はとても小さく見える。,"( )( ) the top of the mountain, the city looks very small.",-,"Seen from the top of the mountain, the city looks very small.",Seen / from,「(街を)山の上から見ると→ (街は) 山の上から見られると」という受動の関係。,受動態の分詞構文は Being や Having been が省略され、過去分詞で始めることが多い。「~されると→~すると」、「~されて→~して」。,-,"英作文や会話においては、183~185のような否定形・完了形・受動態の分詞構文を無理に使う必要はない。because, after, when, soなどの接続詞を使って表現すればよい。",spend / look at / difficulty / see
28,7章,分詞,-,-,186,発展,-,F 111,祝日だったので、通りはとてもにぎやかだった。,"( )( ) a public holiday, the streets were very busy.",-,"It being a public holiday, the streets were very busy.",It / being,主節の主語と分詞構文の主語が一致しない文なので、分詞構文に意味上の主語が必要。主節の主語は the streets 「通り」。分詞構文で表す「祝日なので」には、「時」を表す主語を置く。,"分詞構文の主語が主節の主語と一致しない場合、意味上の主語を明確にするため、分詞の前に意味上の主語を置く。これを独立分詞構文と呼ぶ。この文では、主節の主語は the streets, 分詞構文の主語は「時を表すit」。",-,独立分詞構文はフォーマルな文書や文学的な表現として使われる。英作文や会話では、慣用的な独立分詞構文以外はbecause などの接続詞を使って表現すればよい。,it / be / consider / generally / impact / appearance
29,7章,分詞,-,-,187,発展,-,-,いろいろ考えると、私たちは空港までタクシーで行ったほうがいい。,"( )( )( ), we should take a taxi to the airport.",-,"All things considered, we should take a taxi to the airport.",All / things / considered,「すべてのことが考慮されると」と表現する。意味上の主語を分詞の前に置く。,all things considered 「すべてのことを考慮すると」。all things が意味上の主語。all things are considered という受動の関係。,-,-,it / be / consider / generally / impact / appearance
30,7章,分詞,-,-,188,基本,-,-,一般的に言って、人は変化を好まないものだ。,"(G )( ), people do not like change.",G,"Generally speaking, people do not like change.",Generally / speaking,「一般的に言えば」を表す定型表現(慣用的な独立分詞構文)は?,慣用的な独立分詞構文では、分詞の主語が主節の主語と一致していなくても、分詞の前に意味上の主語を置かない。「不特定多数の人々」や「話し手」などが分詞の意味上の主語であり、わざわざ示さなくても意味が通じるためである。generally speaking 「一般的に言えば」,-,-,it / be / consider / generally / impact / appearance
31,7章,分詞,-,-,189,発展,-,-,ソーシャルメディアの影響を考慮すると、個人情報を共有しないことが重要だ。,"( ) the ( )( )( )(m ), it is important to avoid sharing personal information.",m,"Considering [Given] the impact of social media, it is important to avoid sharing personal information.",Considering [Given] / impact / of / social / media,「~を考慮すれば」を表す定型表現は?,considering A / given A 「Aを考慮すれば」,"impact ①名詞「影響」②動詞 「~に影響する」, avoid doing 「~するのを避ける、~しないようにする」",-,it / be / consider / generally / impact / appearance
32,7章,分詞,-,-,190,基本,-,F 111,外見から判断すると、彼はスポーツが得意かもしれない。,"( )( ) his (a ), I think he might be good at sports.",a,"Judging from his appearance, I think he might be good at sports.",Judging / from / appearance,「~から判断すると」を表す定型表現は?,judging from [by] A 「Aから判断すると」,"appearance「外見」, be good at A 「Aが得意だ」 ⇔ be bad [poor] at A 「Aが下手だ、Aが苦手だ」",-,it / be / consider / generally / impact / appearance
33,7章,分詞,-,-,163-1,精選英作文,-,-,多くの製品はリサイクル素材から作られている。,(recycled/from/made/materials / are).,-,Many products are made from recycled materials.,are / made / from / recycled / materials,-,-,-,-,-
34,7章,分詞,-,-,163-2,精選英作文,-,-,出生率の低下はよく議論される問題だ。,The (issue/much-discussed/birth rate /a/ is / declining).,-,The declining birth rate is a much-discussed issue.,declining / birth / rate / is / a / much-discussed / issue,-,-,-,-,-
35,7章,分詞,-,-,164-1,精選英作文,-,-,一人暮らしの高齢者が増えている。,(people/of/living/ the number / elderly / alone) is increasing.,-,The number of elderly people living alone is increasing.,The / number / of / elderly / people / living / alone,-,-,-,-,-
36,7章,分詞,-,-,164-2,精選英作文,-,-,外国語で書かれたメニューを提供しているレストランもある。,Some restaurants (in/written/languages/foreign/offer/menus).,-,Some restaurants offer menus written in foreign languages.,offer / menus / written / in / foreign / languages,-,-,-,-,-
37,7章,分詞,-,-,166,精選英作文,-,-,いすにバッグが置き忘れてあり、女性がそれを手に取ろうとしている。,"(a/bag/is/left / on / there) the chair, and the woman is picking it up.",-,"There is a bag left on the chair, and the woman is picking it up.",There / is / a / bag / left / on,-,-,-,-,-
38,7章,分詞,-,-,167,精選英作文,-,-,犬が飼い主のもとに走って来た。,(running/ the dog/to/his owner / came).,-,The dog came running to his owner.,The / dog / came / running / to / his / owner,-,-,-,-,-
39,7章,分詞,-,-,168,精選英作文,-,-,子どもは親の影響を受けて育つ。,(their parents/by/up/influenced/children/grow).,-,Children grow up influenced by their parents.,Children / grow / up / influenced / by / their / parents,-,-,-,-,-
40,7章,分詞,-,-,169,精選英作文,-,-,お待たせしてしまって申し訳ありません。,I'm (waiting/to/you/kept/sorry / have).,-,I'm sorry to have kept you waiting.,sorry / to / have / kept / you / waiting,-,-,-,-,-
41,7章,分詞,-,-,171,精選英作文,-,-,昨夜のコンサートで先生が踊っているのを見た。,(dancing/teacher/at/my/saw/1) the concert last night.,-,I saw my teacher dancing at the concert last night.,I / saw / my / teacher / dancing / at,-,-,-,-,-
42,7章,分詞,-,-,174-1,精選英作文,-,-,写真を撮られるのが好きではない人もいる。,Some people (taken / having/do/like/not/their picture).,-,Some people do not like having their picture taken.,do / not / like / having / their / picture / taken,-,-,-,-,-
43,7章,分詞,-,-,174-2,精選英作文,-,-,私はローマの地下鉄で財布を盗まれた。,(wallet/1/stolen / had/my) on the subway in Rome.,-,I had my wallet stolen on the subway in Rome.,I / had / my / wallet / stolen,-,-,-,-,-
44,7章,分詞,-,-,175,精選英作文,-,-,私は何とか英語で意思を伝えることができた,(1/myself/to/understood/managed/make) in English.,-,I managed to make myself understood in English.,I / managed / to / make / myself / understood,-,-,-,-,-
45,7章,分詞,-,-,178,精選英作文,-,-,その女性は腕を組んで立っている,The woman (arms/is/ folded/her/standing / with).,-,The woman is standing with her arms folded.,is / standing / with / her / arms / folded,-,-,-,-,-
46,7章,分詞,-,-,179,精選英作文,-,-,彼らは今週末の吹奏楽演奏会の練習で忙しい。,(the brass band concert/they/practicing/are/busy/for) this weekend.,-,They are busy practicing for the brass band concert this weekend.,They / are / busy / practicing / for / the / brass / band / concert,-,-,-,-,-
47,7章,分詞,-,-,180,精選英作文,-,-,多くの子どもはスクリーンを見るのに時間を使い過ぎだ。,Many children (looking/too/time/spend/at/ much) screens.,-,Many children spend too much time looking at screens.,spend / too / much / time / looking / at,-,-,-,-,-
48,7章,分詞,-,-,181,精選英作文,-,-,多くの家庭が子どもの教育費の支払いに苦労している。,Many families (have/paying/education / for / their children's / difficulty).,-,Many families have difficulty paying for their children's education.,have / difficulty / paying / for / their / children's / education,-,-,-,-,-
49,7章,分詞,-,-,183,精選英作文,-,-,アプリの使い方がわからず、友達に助けを求めた。,"(to/knowing/ the app/not/use/how), I asked my friends for help.",-,"Not knowing how to use the app, I asked my friends for help.",Not / knowing / how / to / use / the / app,-,-,-,-,-
50,7章,分詞,-,-,187,精選英作文,-,-,いろいろ考えると、私たちは空港までタクシーで行ったほうがいい。,"(we/considered, / take /all/should / things) a taxi to the airport.",-,"All things considered, we should take a taxi to the airport.","All / things / considered, / we / should / take",-,-,-,-,-
51,7章,分詞,-,-,188,精選英作文,-,-,一般的に言って、人は変化を好まないものだ。,"(do/people/generally/like/speaking, / not) change.",-,"Generally speaking, people do not like change.","Generally / speaking, / people / do / not / like",-,-,-,-,-
52,7章,分詞,-,-,189,精選英作文,-,-,ソーシャルメディアの影響を考慮すると、個人情報を共有しないことが重要だ,"(it/is/social media, / the impact/of/considering) important to avoid sharing personal information.",-,"Considering the impact of social media, it is important to avoid sharing personal information.","Considering / the / impact / of / social / media, / it / is",-,-,-,-,-
53,7章,分詞,-,-,190,精選英作文,-,-,外見から判断すると、彼はスポーツが得意かもしれない。,"(1/judging/appearance, / his/think/from) he might be good at sports.",-,"Judging from his appearance, I think he might be good at sports.","Judging / from / his / appearance, / I / think",-,-,-,-,-
1,8章,関係詞,-,-,191-1,基本,-,F 113,その国では18歳以上の人は誰でも投票できる。,Anyone (w)( ) 18 years or older can vote in the country.,w,Anyone who is 18 years or older can vote in the country.,who / is,「誰でも(先行詞)」と「18歳以上である」を関係代名詞でつなぐ。「誰もが18歳以上である」ので、主格の関係代名詞を使う。,"関係詞は直前の名詞(先行詞)と直後の節(関係詞節)をつなぎ、名詞を修飾する。主格の関係代名詞 who [that]を使った文。問題文は人(anyone)が先行詞で、関係代名詞は主語の働きをしている。先行詞が「人」の場合,whoを使うことが多い。anyone は単数扱い。",18 years (of age) or older 「18歲以上」,-,make / need / would like to / visit
