ID,章,章タイトル,節,節タイトル,問題番号,難易度,文法事項,Focus,日本語,英文（穴埋め）,ヒント,英文（完全）,答え,Tip（思考誘導）,解説,語句・熟語,注意・補足,Words to Use
1,1章,時制・完了形,-,-,1-1,基本,-,F 023,父はよくネットで買い物をする。,My father often ( )( ).,-,My father often shops online.,shops / online,「現在の習慣」を表すとき、時制はどうする? 「買い物をする」を1語の自動詞で表すと? 「ネットで」を1語の副詞で表すと?,現在形は「今この瞬間」ではなく、「現在を含む広い範囲の時」を表す。現在の状態や現在の習慣的・反復的動作、変わらない事実や真理を表す。,このshop は自動詞。英語では1つの単語が複数の品詞で使われることがある。 ○ shop online 「ネットで買い物をする」 - online shop 「ネットショップ」,-,shop / online / go around / care / start / water / rain / resemble
2,1章,時制・完了形,-,-,1-2,基本,-,F 024,地球は太陽の周りを回っている。,The Earth ( )( ) the Sun.,-,The Earth goes around the Sun.,goes / around,「過去・現在・未来を通じて変わらない事実」を表すとき、時制はどうする?,過去・現在・未来を通じて変わらない事実や真理を表すときは現在形を使う。,○ go around A 「Aの周りを回る」,-,shop / online / go around / care / start / water / rain / resemble
3,1章,時制・完了形,-,-,1-3,基本,-,F 034,ペットの世話は子どもに責任感を教える。,(C) for pets (t) children responsibility.,C / t,Caring for pets teaches children responsibility.,Caring / teaches,「ペットの世話をすること」を主語にするときどうする? 動詞が現在形のときに注意しないといけないことは?,主語が3人称単数の場合、動詞が現在形のときは、3単現(3人称単数現在)の-sが必要。動名詞や不定詞の主語は単数扱いになる。,○ care for a pet 「ペットの世話をする」,-,shop / online / go around / care / start / water / rain / resemble
4,1章,時制・完了形,-,-,2,基本,-,-,コンサートは6時半から始まる。,The concert ( )( ) six thirty.,-,The concert starts at six thirty.,starts / at,すでに確定していて、確実にやって来る未来の予定を表す時制は?,交通機関の時刻や劇場の開始予定など、現時点で確定している未来の予定については現在形を使う。時の一点を示す前置詞はat。「~から始まる→~に始まる」,-,-,shop / online / go around / care / start / water / rain / resemble
5,1章,時制・完了形,-,-,3-1,基本,-,F 025,その女性は花に水をやっている。,The woman ( )( ) some flowers.,-,The woman is watering some flowers.,is / watering,「現在行っている動作」を表す形は? 「~に水をやる」を表す他動詞は?,「(今)~している(ところだ)」という今まさに行われている動作や行為を表すのは現在進行形。現在進行形はam/are/is doingの形。,○ water flowers 「花に水をやる」 ―このwater は他動詞,-,shop / online / go around / care / start / water / rain / resemble
6,1章,時制・完了形,-,-,3-2,基本,-,"F 023, F 025",ケンはいつも自転車で通学しているが、雨が降っているので今日はバスに乗っている。,"Ken usually ( ) to school by bike, but today he is on the bus because it ( )( ).",-,"Ken usually goes to school by bike, but today he is on the bus because it is raining.",goes / is / raining,「いつもの習慣」を表すときの時制は? 「今まさに〜している」を表す形は?,「~している」が常に現在進行形とは限らない。「いつも〜する」という現在の習慣は現在形、「~している」という今まさに起こっていることは現在進行形で表す。,-,-,shop / online / go around / care / start / water / rain / resemble
7,1章,時制・完了形,-,-,4,基本,-,-,その留学生はトム・ホランドにちょっと似ている。,The international student ( ) Tom Holland a bit.,-,The international student resembles Tom Holland a bit.,resembles,「〜している」がすべて進行形になるとは限らない。「似ている」を表す動詞の形は?,動詞には動作や行為を表す動作動詞(~する)と、ある状態が続いていることを表す状態動詞(〜である、~している)の区別がある。状態動詞は原則として進行形にしない。resemble 「~に似ている」は状態動詞。,international student「留学生」,-,shop / online / go around / care / start / water / rain / resemble
8,1章,時制・完了形,-,-,5,基本,-,-,プラスチックごみが環境を破壊している。,Plastic waste ( )(d) the environment.,d,Plastic waste is damaging the environment.,is / damaging,「(ある程度長い時間)~している」ことを切迫感や臨場感を伴って表す形は?,現在進行形を使うことで、切迫感や臨場感を表すことができる。,"○ plastic waste 「プラスチックごみ」, ○ damage the environment「環境を破壊する」",-,damage / get / climb / ago / call / make / be~back
9,1章,時制・完了形,-,-,6,基本,-,F 034,その2人は来年結婚する。,The couple ( )( ) married next year.,-,The couple are [is] getting married next year.,are [is] / getting,「計画が進行中の未来の予定」を表す形は?,すでに計画が進行中で具体的な準備が進んでいる場合は現在進行形を使って未来の予定を表せる。この用法は未来を表す時の副詞と共に使うのが普通。,couple 「1組の男女」は単数扱い・複数扱いのどちらでも可。 get married「結婚する」,-,damage / get / climb / ago / call / make / be~back
10,1章,時制・完了形,-,-,7-1,基本,-,F 027,おととしの夏、家族で富士山に登った。,I ( ) Mt. Fuji with my family two ( ) ago.,-,I climbed Mt. Fuji with my family two summers ago.,climbed / summers,「おととしの夏」は「2つの夏の前」と表現する。過去を示す表現と共に使われる時制は?,過去形は「過去のこと」を表す時制。過去の長い期間の状態、過去1回きりの動作・行為・出来事、過去の習慣的・反復的動作はすべて過去形で表すことができる。~ago 「~前に」などの過去を表す語句と共に使う。,two summers ago 「おととしの夏」,-,damage / get / climb / ago / call / make / be~back
11,1章,時制・完了形,-,-,7-2,発展,-,F 026,小学生の時、1年間東京に住んでいたことがある。,I ( ) in Tokyo for a year when I ( ) in elementary school.,-,I lived in Tokyo for a year when I was in elementary school.,lived / was,「~していたことがある」という日本語に惑わされない。「小学生の時」は過去。,「住んでいたことがある」というのは、「(当時) 住んでいた」という「現在とは切り離された過去の状態」を表すので過去形を使う。完了形にはしない。,when S' was in elementary school 「S' が小学生の時」,-,damage / get / climb / ago / call / make / be~back
12,1章,時制・完了形,-,-,8,基本,-,F 028,友人が電話した時、サラは図書館で勉強していた。,Sara ( )( ) in the library when her friend ( ) her.,-,Sara was studying in the library when her friend called her.,was / studying / called,「電話した」のは「過去の一時点」、「勉強していた」のは「その時に行われていた行為」。それぞれ適切な動詞の形は?,「(その時)~していた、〜している途中だった」という「過去のある時点」において一時的に行われていた動作や行為は過去進行形 was/were doing で表す。,-,-,damage / get / climb / ago / call / make / be~back
13,1章,時制・完了形,-,-,9-1,基本,-,F 029,自動運転車は交通をより安全にするだろう。,Self-driving cars ( )( ) transportation safer.,-,Self-driving cars will make transportation safer.,will / make,「~するだろう」と未来に起こると予想される事柄を表す一般的な表現は?,"未来の事柄は will do, be going to do などの未来を表す表現を使う。will do は未来に起こると予想される事柄を表す一般的な表現。will do①「~だろう」 ② 「~するつもりだ、〜します」","self-driving car「自動運転車」, make A safer 「Aをより安全にする」, transportation「輸送手段,交通手段」一複数形にはならない。",-,damage / get / climb / ago / call / make / be~back
14,1章,時制・完了形,-,-,9-2,基本,-,F 029,「裕子おばさんが3時にここに来るから、早く帰って来なさい。」「わかった。その時までには帰るよ。」,"""Aunt Yuko (w)( )( )( ) at 3:00. Come home early."" ""ΟΚ. ( )(b)( ) by then.""",w / b,"""Aunt Yuko will be here at 3:00. Come home early."" ""OK. I'll be back by then.""",will / be / here / I'll / be / back,「~するよ」という「その場で決めた未来の意志」を表す表現は?,1文めは予想される未来の事柄を表す。応答文の2文めは「~するつもりだ、~します」という主語の意志を表し、このwill を意志未来のwill と呼ぶ。,by then 「その時までには」,-,damage / get / climb / ago / call / make / be~back
15,1章,時制・完了形,-,-,9-3,基本,-,F 030,「7時まで図書館で勉強する予定なんだ。」「そうなの?」,"""( )(g)( )( ) in the library until 7:00."" ""Are you?""",g,"""I'm going to study in the library until 7:00."" ""Are you?""",I'm / going / to / study,「発話の時点ですでに決めてある未来の予定」を表す表現は?,be going to do は発話の時点ですでに決まっている未来の予定を表す。be going to do の疑問文はbe動詞を文頭に出す。,"be going to do 「~する予定だ」, until+時刻 「〜までずっと」",-,damage / get / climb / ago / call / make / be~back
16,1章,時制・完了形,-,-,10,発展,-,F 031,土曜日の午後、私たちはビーチの清掃をしているだろう。,We ( )( )(c) up the beach on Saturday afternoon.,c,We will be cleaning up the beach on Saturday afternoon.,will / be / cleaning,「未来のある時点」において「~しているだろう」を表す表現は?,「~しているだろう」という未来のある時点において行われているであろう動作は未来進行形 will be doing で表す。,"clean (up) the beach 「ピーチを清掃する」, on Saturday afternoon 「土曜の午後に」",-,clean / start / know / learn
17,1章,時制・完了形,-,-,11,基本,-,F 035,映画が始まろうとしていて、人々が席に着いているところだ。,The movie ( )( )( )( ) and people are taking their seats.,-,The movie is about to start and people are taking their seats.,is / about / to / start,「まさに〜しようとしている」という「差し迫った未来」を表す表現は?,be going to do 「~する予定だ」よりも差し迫った未来を表す。,"be about to do 「まさに〜しようとしている」, take a [one's] seat 「席に着く」",-,clean / start / know / learn
18,1章,時制・完了形,-,-,12,基本,-,F 036,ここ数年で私たちの生活様式はずいぶん変わった。,Our way of life ( )( ) a lot in the last few years.,-,Our way of life has changed a lot in the last few years.,has / changed,「ここ数年で」ということは、「過去」からの変化が「現在」にも及んでいるということ。これを表す適切な表現は?,「過去の出来事」と「現在」をつなぐ表現が現在完了形。have+過去分詞 (done)で表す。現在までの動作・行為の完了・結果 「~したところだ、〜してしまって･･･だ」,in the last [past] few years 「ここ数年で」,-,clean / start / know / learn
19,1章,時制・完了形,-,-,13-1,基本,-,F 037,その話は前に聞いたことがある。,I ( )( ) that story before.,-,I have heard that story before.,have / heard,「過去にその話を聞いて、今それを知っている」を表す形は?,現在までの経験 「~したことがある」。過去に聞いて、今それを知っているということ。現在に焦点がある。,before「以前に」,-,clean / start / know / learn
20,1章,時制・完了形,-,-,13-2,基本,-,F 037,何度か東京に行ったことがある。,I ( )( )( ) Tokyo several times.,-,I have been to Tokyo several times.,have / been / to,「~に行ったことがある」という経験を表す表現は?,have been to A 「Aに行ったことがある(経験)」,"several times 「数回,何度か」",-,clean / start / know / learn
21,1章,時制・完了形,-,-,14,基本,-,F 038,ケンとは小学校で一緒だった頃からの付き合いだ。,I ( )( ) Ken since we were in elementary school together.,-,I have known Ken since we were in elementary school together.,have / known,「付き合いだ→ ずっと知っている」と考える。現在までの状態の継続を表す形は?,現在までの状態の継続 「ずっと〜だ」。「状態の継続」の用法で使う動詞は状態動詞。,-,-,clean / start / know / learn
22,1章,時制・完了形,-,-,15,基本,-,F 039,私は8年間、英語を習っている。,I ( )( )( ) English for eight years.,-,I have been learning English for eight years.,have / been / learning,「ずっと〜し続けている」を表す形は? 「過去から現在までの動作の継続」を表す。,「動作の継続」は完了進行形で表す。現在までの動作の継続 「ずっと〜し続けている」。動作動詞を使って現在完了進行形 have been doing で表す。,-,-,clean / start / know / learn
23,1章,時制・完了形,-,-,16-1,基本,-,F 041,駅に着いた時には、電車はすでに出発してしまっていた。,The train ( )( )( ) when I (g) to the station.,g,The train had already left when I got to the station.,had / already / left / got,「過去のある時点」までに完了した動作・行為を表す形は?,過去完了形は、「過去のある時点」と「さらに前の過去の時点」をつなぐ表現。過去のある時点までの動作・行為の完了・結果 「~してしまっていた」,-,-,leave / get / realize / lately / become
24,1章,時制・完了形,-,-,16-2,基本,-,F 042,昨年ニューヨークに行くまで、ミュージカルを見たことがなかった。,I ( ) never ( ) a musical until I ( ) to New York last year.,-,I had never seen a musical until I went to New York last year.,had / seen / went,「過去のある時点」までに「~したことがあった」を表す形は?,過去のある時点までの経験 「~したことがあった」。never があるので「~したことがなかった」の意味になる。until は接続詞。,-,-,leave / get / realize / lately / become
25,1章,時制・完了形,-,-,17,基本,-,F 045,駅に着いた時、家にスマートフォンを忘れてきたことに気がついた。,"When I got to the station, I ( ) that I ( )( ) my smartphone at home.",-,"When I got to the station, I realized that I had left my smartphone at home.",realized / had / left,「気がついた」 よりも前の時点で「スマートフォンを忘れた」を表す形は?,過去に起こった2つの出来事を述べるとき、時間的な前後関係を明確に表すために「先に起こった出来事」を過去完了形にする。この用法を大過去という。,-,-,leave / get / realize / lately / become
26,1章,時制・完了形,-,-,18,基本,-,F 044,今朝から雨が降っていたが、今はやんでいる。,"It ( )( )( ) since this morning, but now it has stopped.",-,"It had been raining since this morning, but now it has stopped.",had / been / raining,「ずっと〜し続けていた」を表す形は? 過去のある時点で「やんだ」ということ。,過去のある時点までの動作の継続 「ずっと〜し続けていた」。動作動詞を使って過去完了進行形 had been doing で表す。,-,-,leave / get / realize / lately / become
27,1章,時制・完了形,-,-,19,基本,-,F 046,君が来るまでには宿題を終えているだろう。,I (w)( )( ) my homework by the time you come over.,w,I will have finished my homework by the time you come over.,will / have / finished,「君が来る」のは「未来のある時点」。その時点までの動作の完了を表す形は?,未来のある時点までの「動作・行為の完了・結果」「経験」 「状態の継続」を未来完了形 will have +過去分詞(done)で表す。,come over 「やって来る」,-,leave / get / realize / lately / become
28,1章,時制・完了形,-,-,20-1,基本,-,F 040,近頃、ネットショッピングがますます人気になってきている。,"( ), online shopping (h)(b) more and more popular.",h / b,"Lately, online shopping has become more and more popular.",Lately / has / become,最近の出来事を、「過去から現在まで」という時の流れで表すか、「今起こっていること」と表すかで、2つの時の表現が可能。それぞれに適した「近頃」を表す副詞(句) を使う。,"lately/recently「最近」, so far/until now/up to now 「今までのところ」 などの「過去から現在へ」という意味の広がりがある語句は、現在完了形と共に使うことが多い。",become [get] more and more popular 「ますます人気になる」,-,leave / get / realize / lately / become
29,1章,時制・完了形,-,-,20-2,基本,-,F 040,近頃、ネットショッピングがますます人気になってきている。,"( )( ), online shopping (i)(b) more and more popular.",i / b,"These days, online shopping is becoming more and more popular.",These / days / is / becoming,最近の出来事を、「過去から現在まで」という時の流れで表すか、「今起こっていること」と表すかで、2つの時の表現が可能。それぞれに適した「近頃」を表す副詞(句) を使う。,these days / nowadays 「この頃、近頃」は、「現在」を示す副詞(句)なので、現在形・現在進行形と共に使うことが多い。,-,-,leave / get / realize / lately / become
30,1章,時制・完了形,-,-,20-3,基本,-,-,これまでのところ、そのシリーズは3話見た。,I ( )( ) three episodes of the series ( )( ).,-,I have watched three episodes of the series so far.,have / watched / so / far,「これまでのところ」は「過去から現在まで」のこと。動詞の形はどうする?,so far / until now / up to now 「これまでのところ、今までのところ」は現在完了形と共に使うことが多い。,-,-,leave / get / realize / lately / become
31,1章,時制・完了形,-,-,21,基本,-,F 040,私は先月、テニスを始めたばかりだ。,I ( )( ) playing tennis ( )( ).,-,I just started playing tennis last month.,just / started / last / month,「始めたばかりだ」という日本語に惑わされない。「先月」という過去の時点を表す語句があるから時制はどうなる?,「先月」は過去の時点を表す語句。過去形を使って「先月〜した」と表現する。,-,-,start / get to / stop / talk / use
32,1章,時制・完了形,-,-,22,基本,-,F 032,ホテルに着いたらメッセージを送ります。,I will text you ( ) I ( )( ) the hotel.,-,I will text you when I get to the hotel.,when / get / to,この文の「~したら」は「ほぼ確実に起こること」を述べているのだから「条件」ではない。「ホテルに着いたら→ ホテルに到着した時」ということなので「時」を表す接続詞を使う。ホテルに到着するのは未来のことだが、時を表す副詞節の中なので時制は?,時や条件を表す副詞節の中では、未来のことでもwill は使わず、現在形や現在完了形を使う。,"when... 「･･･する時に」 一副詞節を導く接続詞, get to A 「Aに到着する」",-,start / get to / stop / talk / use
33,1章,時制・完了形,-,-,23,基本,-,F 032,雨がやむまでここで待つつもりです。,I'll wait here ( ) the rain ( ).,-,I'll wait here until the rain stops.,until / stops,「~するまで」という「時を表す副詞節」の中の時制は?,until ... = till... 「･･･するまでずっと」,the rain stops 「雨がやむ」,-,start / get to / stop / talk / use
34,1章,時制・完了形,-,-,24,基本,-,F 220,両親と相談し次第、私の決断をお知らせします。,I'll let you know my decision ( )( )( ) I ( )( ) to my parents.,-,I'll let you know my decision as soon as I have talked to my parents.,as / soon / as / have / talked,「~し次第」は「~するとすぐに」ということ。「両親と話し合いをしたらすぐに」と完了のニュアンスがあることを考えると、動詞の時制はどうするのが適切?,as soon as... 「･･･するとすぐに」,"let you know 「あなたに知らせる」, talk to [with] one's parent(s) 「親 [両親] と相談する」",-,start / get to / stop / talk / use
35,1章,時制・完了形,-,-,25,基本,-,F 032,車の代わりに公共交通機関を利用すれば、二酸化炭素の排出の削減に貢献できる。,"( ) we ( ) public transportation instead of cars, we can help to reduce CO2 emissions.",-,"If we use public transportation instead of cars, we can help to reduce CO2 emissions.",If / use,条件を表す副詞節の中の時制は? 「利用する=使う」,if... 「もし･･･ならば」 一副詞節を導く if,"public transportation / public transport「公共交通機関」, help (to) do 「~する助けとなる」, CO2 emissions 「二酸化炭素の排出(量)」",-,start / get to / stop / talk / use
36,1章,時制・完了形,-,-,26,基本,-,F 221,誰が送ったのかわからなければ、ファイルを開けるべきではない。,You should not open a file ( ) you ( ) who sent it.,-,You should not open a file unless you know who sent it.,unless / know,「･･･でなければ」を表す接続詞1語と、その後の動詞の形は?,unless ... [･･･でなければ、･･･しない限り」。〈unless+肯定文〉で「･･･でなければ、･･･しない限り」という否定の意味になる。unless の後を否定文にしないこと。,-,-,start / get to / stop / talk / use
37,1章,時制・完了形,-,-,27,基本,-,-,すみませんが、いつ公演が始まるか教えていただけますか。,"Excuse me, could you tell me ( ) the performance ( )( )?",-,"Excuse me, could you tell me when the performance will start?",when / will / start,〈tell+O+O〉の形。「いつ･･･するか」 は動詞の目的語なので名詞節。未来のことを表すとき、名詞節の中の時制は?,when 節や if節が名詞節の場合、未来のことは will do などで表す。,"when... 「いつ･･･するか」 ―この when は疑問詞で、名詞節を導く。, Excuse me, could you ...? 「すみませんが･･･していただけますか。」",-,start / get to / stop / talk / use
38,1章,時制・完了形,-,-,28,基本,-,F 215,ケンが今夜、パーティーに来るかどうかわからない。,I don't know ( ) Ken ( )( ) to the party tonight.,-,I don't know if [whether] Ken will come to the party tonight.,if / will / come,「･･･するかどうか」を表す接続詞は? 名詞節の中の時制に注意。,if... 「･･･するかどうか」 一名詞節を導くif = whether ... 。if節は名詞節でknowの目的語。名詞節の場合、未来のことはwill do などで表す。,-,-,pass / join / dead
39,1章,時制・完了形,-,-,29-1,発展,-,F 038,私が陸上部に入部してから3か月がたった。,Three months ( )( )( ) I ( ) the track and field team.,-,Three months have passed since I joined the track and field team.,have / passed / since / joined,「陸上部に入部した」のは過去。「3か月たった」のは「過去から現在」の時間の幅があると考えると時制はどうなる?,since... 「･･･して以来」 期間+have passed since S'+V',pass はここでは「(期間)が経過する」を意味する自動詞。,-,pass / join / dead
40,1章,時制・完了形,-,-,29-2,発展,-,F 038,私が陸上部に入部してから3か月がたった。,(I)( )( ) three months ( )( )(j) the track and field team.,I / j,It has been three months since I joined the track and field team.,It / has / been / since / I / joined,「陸上部に入部した」のは過去。「3か月たった」のは「過去から現在」の時間の幅があると考えると時制はどうなる?,It has been +期間+since S'+V' 「･･･してから~(の期間)がたった」,-,-,pass / join / dead
41,1章,時制・完了形,-,-,30,基本,-,F 038,祖父が亡くなって3年になる。,My grandfather ( )( )( )( ) three years.,-,My grandfather has been dead for three years.,has / been / dead / for,「亡くなっている」は形容詞を使って表現する。「3年間亡くなった状態でいる」ると時制はどうなる?,S have been dead for +期間 「Sが亡くなってから~(期間)になる」。「~(期間)の間Sが死んでいる状態が続いている」という現在までの状態の継続を表す現在完了形。,-,-,pass / join / dead
